<?xml version="1.0" encoding="UTF-8" ?>
<!DOCTYPE Persons SYSTEM "person.dtd">
<Persons>
    <Person>
    <Email>cloud@mail.ru</Email>
   <Nickname>cloud</Nickname>
    <Password>12345</Password>
    <Descriptions>
        <Description>
            <Name>451 градус по Фаренгейту</Name>
            <Genre>научно-фантастический роман-антиутопия</Genre>
           <Author>Рэя Брэдбери</Author>
            <Released> 1953 </Released>
        </Description>
        <Description>
            <Name>Три мушкетёра</Name>
            <Genre> историко-приключенческий роман</Genre>
            <Author>Александр Дюма</Author>
            <Released>1844</Released>
        </Description>
    </Descriptions>
    </Person>
</Persons>